{
  "updateVersion": 1,
  "version": "0.2.0",
  "channel": "stable",
  "minimumVersion": "0.1.0",
  "architecture": "amd64",
  "commit": "c2e871a0f3b1",
  "publishedAt": "2026-10-09T21:00:00Z",
  "kernel": {
    "release": "6.12.111+deb13-amd64",
    "zfs": "2.3.9-0+deb13u1"
  },
  "files": [
    {
      "path": "debs/Packages",
      "sha256": "ca978112ca1bbdcafac231b39a23dc4da786eff8147c4e72b9807785afee48bb",
      "size": 1
    },
    {
      "path": "debs/Release",
      "sha256": "3e23e8160039594a33894f6564e1b1348bbd7a0088d42c4acb73eeaed59c009d",
      "size": 1
    },
    {
      "path": "debs/../../etc/passwd",
      "sha256": "2e7d2c03a9507ae265ecf5b5356885a53393a2029d241394997265a1a25aefc6",
      "size": 1
    }
  ],
  "packages": [
    {
      "name": "pithyx",
      "version": "0.2.0",
      "path": "debs/pithyx_0.2.0_amd64.deb"
    },
    {
      "name": "pithyx-kernel",
      "version": "0.2.0",
      "path": "debs/pithyx-kernel_0.2.0_amd64.deb"
    }
  ],
  "changelog": "### Added\n\n- Updates with rollback."
}
